TAM_MSA_37,tam,NEUTRAL,அப்படியே செல்வராகவன் படம் மாதிரியே இருக்கு நாங்களும் செல்வராகவன் கிட்ட மாதிரியான படங்களதான் எதிர்பார்க்கிறோம் இரண்டாம் உலகம் மாதிரியான படங்களை தேவையே இல்லை எடுக்கறதுக்கு பணம் இருந்தால் போதும் இரண்டாம் உலகம் படத்தை எவன் வேணுமென்றாலும் எடுக்கலாம் ஆனால் மாதிரியான படங்கள் எடுக்கறதுக்கு செல்வராகவன் மாதிரி விஷயங்கள் தெரிந்த டைரக்டர் மத்தபடி கதைக்கு ஏற்ற மாதிரி சரியான ஹீரோ-ஹீரோயின் தேர்ந்தெடுத்து போட்டு இருக்காங்க புது முகங்களாக இருந்தாலும் ரொம்ப நல்லா நடிச்சிருக்காங்க அவங்களும் படத்துல வசனம் ரொம்ப நல்லா இருக்கு மத்த டெக்னீசியன்ஸ் உம் ரொம்ப நல்லா வொர்க் பண்ணியிருக்காங்க இன்னைக்கு படம் ரிலீஸ் ஆயிருக்கு பெரிய ஓப்பனிங் இல்லை படத்தினுடைய ரிப்போர்ட் வேலா முகத்திலே போய் பிக்கப் ஆகிறதுக்கு வாய்ப்பு இருக்கு மொத்தத்தில் படம் எப்படி இருக்கு அப்படி கேட்டீங்கன்னா வழக்கமான செல்வராகவன் பாணியிலேயே படமும் அமைச்சிருக்கு செல்வராகவன் படத்திலே எப்படி அடல்ட்ஸ் ஒன்லி சீன் இருக்குமோ படத்திலும் கண்டிப்பா இருக்கு மொத்தத்துல படம் எப்படி இருக்குனு கேட்டீங்கன்னா நீண்ட இடைவேளைக்கு செல்வராகவன் படம் பார்க்கிற மாதிரி இருக்கு எப்படி செல்வராகவன் படத்தில் குடும்பத்தோடு கூடிப்போய் பார்க்கமுடியாத அடல்ஸ் ஒன்லி சீன் இருக்குமோ படத்திலும் இருக்கு படங்கள் அளவுக்கு படம் ஒப்பீட்டு பார்க்க முடியாது கூட தனிப்பட்ட முறையிலே இதுவும் வித்தியாசமான படம் நிச்சயமாக படத்தை பார்க்கலாம்
TAM_MSA_38,tam,NEGATIVE,இவருக்கும் இன் ஃபக்ட் ஆயிருப்பாரோ அப்படின்னு சொல்லிவிட்டு ஆனால் செக்கண்ட் கழித்து அவருக்கு ஒண்ணுமே ஆகியிருக்காது திரும்பி ஓடி வருவார் மாதிரி சீன் எடுக்குறதுக்கு பணம் செலவு பண்ண தேவையில்லை கொஞ்சம் மூளையை கசக்கினால் போதும் இப்படியான சீன் படம் பூரா தேடினால் கூட சீன் கூட இருக்காது சாம்பி படம் என்ராலே கடிக்கிறவன் கடித்துக்கிட்டே இருப்பான் சுடறவன் சுட்டுக்கிட்டே இருப்பான் அப்படீங்கிற விஷயத்தை தப்பா புரிஞ்சுகிட்டு படத்தை எடுத்துட்டு இருக்காங்க இங்கிலீஷ் படங்களையாவது கடிக்கிறவன் கடிச்சுக்கிட்டே இருப்பான் அவங்க கிட்டே தப்பிச்சு ஓடறவங்க ஓடுவாங்க அவங்கள காப்பாற்ற வேண்டிய மிலிட்டரி போலீஸ் ஹீரோ எல்லாரும் சேர்ந்துதான் காப்பாத்துவாங்க ஆனால் படத்திலே கடிக்கிறவன் கடித்துக் கிட்டே இருப்பான் ஜெயம் ரவி ஆள் லட்சக்கணக்கான பேரே சுட்டுக்கிட்டே இருக்காரு என்னதான் தமிழ் படத்தின் ஹீரோ என்றாலும் ஆளு எத்தனை லட்சம் பேரத்தான் சூடுவாரு பாட்டுக்கு சுடடுக்கிட்டே இருக்கிறாரு கடிக்கிறவன் கடிச்சுகிட்டே இருப்பான் படம் முழுக்க இதே இருந்தால் எவ்வளவு நேரம் கடியை தாங்குகிறது மத்தபடி சாம்பி படத்துக்கு உண்டான திகிலோ திருப்பங்களோ பரபரப்போ எதுவுமே பெருசா இல்லைனாலும் தமிழ் சினிமாவுக்கு சாம்பி படம் என்றதனாலே ஒருமுறை பார்த்து வையுங்களேன்
TAM_MSA_39,tam,POSITIVE,படத்துடைய பலம் அப்படின்னு பார்த்தால் சிவகார்த்திகேயன் காமெடி ரொமான்ஸ் ஃபைட் எல்லாத்தையுமே பின்னி எடுத்து இருக்காப்ல கூட வர சூரி கூட சேர்ந்து பண்ற காமெடிகள் ரொம்ப அரைகுறையாய் அதேபோல படத்துல அவங்க டீக்கடை நடத்துவாங்க டீ கடையில வாழைப்பழம் விக்கும் கேரக்டர் கேரக்டர் படம் பூரா த்ரூ அவுட்டா வருது வர்ற சீன் கலகலப்பாய் அதேபோல ராஜ்கிரண் வர சீன எல்லாமே ரொம்ப நல்லா சமுத்திரகனி படம் பூரா பின்னிய படம் எடுத்துட்டு போயிருக்காரு படத்துக்கு இருக்கிற இன்னொருமிக பெரிய பலம் அ என்னென்னா படத்தில் சீனுமே தொய்வு அழிஞசிடக் கூடாது அப்படின்னு கவனமாக கையாண்ட திரைக்கதை படத்தில பலவீனம் அப்படின்னு சொன்னா விஷயம்தான் வலுவில்லாத கதை படம் இன்னைக்கு ரிலீஸ் நாளைக்கு ரிலீஸ் ன்னு அஞ்சாறு வாட்டி டேட் போட்டு படம் தள்ளிப் போயிடுச்சு மாதிரி டேட் போடடு தள்ளி போட்ட படம் படமும் வரைக்கும் உருப்பட்டதில்லை ஆனால் இந்தப்படம் இலக்கணத்தை தகர்த்தெறிஞ்சு விடும் என்பதுதான் உண்மை படம் இப்போ வெளியே வருவதற்கு முக்கியமான காரணம் லிங்குசாமி கோடி ரூபாய் வரைக்கும் கடன் வாங்கி வைத்திட்டாரு கடம் பிரச்சினையினாலே படம் ரிலீஸ் ஆகல இப்ப ரிலீஸ் ஆகரதுக்கு முக்கியமான காரணம் பாம்பை நிர்வாகமான பெண் அப்படின்னு நிறுவனம் லிங்குசாமிக்கு முப்பது கோடி ரூபா வரைக்கும் கடன் கொடுத்து உதவி செஞ்சிருக்காங்க அவர்கூட சேர்ந்து தொடர்ந்து படம் பண்ண போறாங்களா அதனால உதவி செஞ்சிருக்காங்க படம் ரிலீஸ் ஆயிருக்கு மொத்தத்துல படம் எப்படி இருக்கு அப்படின்னு கேட்டீங்கன்னா இன்னைக்கு நாலு படம் ரிலீஸ் ஆயிருக்கு நாலு படத்திலேயும் படத்தை குடும்பத்தோட எல்லாருமா ரசித்து பாத்தாங்க படத்தை அவங்க ஏற்கனவே விளம்பரத்தில் சொல்லியிருந்த மாதிரி நம்பி வாங்க சந்தோஷமா போங்க அப்படின்னு சொல்லி இருந்தாங்க மாதிரி படத்தை நம்பி குடும்பத்தோட போங்க சந்தோஷமாக வெளியே வருவீங்க
TAM_MSA_40,tam,POSITIVE,ஏன்ட் படத்தோட கதாநாயகன் பார்த்தீங்கன்னா மை டியர் பூதம் தொடர் சீரியல் சீரியல்ல நடிச்சவரு அதுக்கு அப்புறம் நீண்ட கேப்புக்கு அப்புறம இதுல கதாநாயகனா நடிச்சிருக்காரு அபிலேஷ் அவர்கள்தான் ஏன்ட்ரொம்ப அழகான கதாபாத்திரம் அவங்களுக்கு பெயர் அப் பண்ணி பார்த்திங்கன்னா லீமா அப்படிங்கிற ஒருத்தர் நடிச்சிருக்காங்க ஏன்ட் அவங்க பார்த்தீங்கன்னா வந்தோம் போனோம் அப்படிங்கிறது கதையில இல்லாமல் ஹீரோக்கு நல்ல ஊக்கம் கொடுக்கிற வகையில் பார்த்தீங்கன்னா நல்ல மோட்டிவேஷன் பண்றாங்க சப்போர்ட் பண்ற வகையில் நடிச்சிருக்காங்க சோ மெச்சூர்ட் லவ் படத்துல நல்லா தெரிகிறது.இந்தப் படத்தில் இசை அமைப்பாளர் ரோஷன் பாடல்களுக்கு உயிர் கொடுத்து இருக்கு அப்படின்னு சொல்லலாம் ஏனா படத்துல ஒன்றி வரக்கூடிய பாடல்கள்தான் அமைஞ்சிருக்கு.ஜெயிக்க போற கூட்டம் தடைகளை உடை பாடல்கள் எல்லாமே நல்லா ஒன்றி போயிருக்கு தன்னம்பிக்கை நிறைந்த பாடல் அப்படீன்னே சொல்லலாம் ரோஷன்அவர்கள் கதைக்கு ஏற்றவாறு அப்படி ஒன்றிப் போய் இருக்கு உயிரோட்டமும் கொடுத்து இருக்கிறாரு சொல்லலாம் ரோஷன் அவர்களெ படத்தில் பார்த்தீங்கன்னா டைரக்டரா இருக்கட்டும் தயாரிப்பாளர் ரெண்டு பேருமே ஊர சார்ந்தவங்க டைரக்டர் ஆக ணும் என்ரதுதான் அவருக்கு கனவா இருக்கப் போயிட்டு ஓரு மோட்டிவேஷனாலே நல்ல தரமான படம் தன்னம்பிக்கையான படம் எடுத்து முடித்திருக்கிறார் தமிழ் சினிமா இண்டஸ்ட்ரியில் தொடர்ந்து மாதிரி படங்கள் வந்துட்டு இருந்தால் வேற பாதையில் கூட தமிழ் சினிமா டிராவல் அப்படின்னு சொல்லலாம் இளைஞர்களுக்கு கபடியே பத்தி தெரியணும் அப்படிங்கறதக்காகவே நல்ல முயற்சியில் இறங்கி இருக்காங்க .சோ அவங்க டீமுக்கு மிகப்பெரிய வாழ்த்துக்கள் சொல்லிடலாம் நீங்களும் மறக்காமல் படத்தை தியேட்டர்க்கு போயி பாருங்க
TAM_MSA_41,tam,POSITIVE,படத்துக்கு கூடுதலான மிகப்பெரிய பிளஸ் மியூசிக் ரஞ்சன் துரைராஜா ப்ளே பண்ணி இருக்காரு கதைக்கு ரொம்ப ஏற்றவாறு மியூசிக் டிராக் எல்லாமே அமைந்திருக்கும் சொல்லலாம் ரஞ்சன் துரைராஜா ரொம்ப நீட்டா ஆண்டு கிளியர் ஆன இசை நமக்கு கொடுத்து இருக்காரு .பன்னீர்செல்வம் சினிமாடோகிராஃபி கொடுத்திருக்கிறார் ஏன்ட் படத்தில் நிறைய ஸ்டண்ட் சீக்வன்ஸ் இருக்கு பிரசாந்த் சார எப்படி நல்லபடியாக யூஸ் பண்ணனுமா ஏனா அவருடைய ஃபைடிங் சீக்வன்ஸ் ஆல்ரெடி நாம பார்த்து இருக்கோம் தொடர்ந்து படத்துக்கும் ரொம்ப தரமான ஃபைட்டிங் கொடுத்து இருக்காரு எடிட்டிங் கொடுத்து இருக்காரு சிவ சரவணன் ஆண்டு எடிட்டிங் அப்படீங்கரப்பதான் படமே டைரக்டர் அப்படின்னா எடிட்டரதான் இடத்தில சொல்லுவோம் ரொம்ப அழகா கச்சிதமா எங்கெல்லாம் கட் பண்ணனுமோ அதெல்லாம் கட் பண்ணி நமக்கு கிளியரா கொடுத்திருக்காங்க அண்ட் பிரசாந்த் சார் மாதிரியான படங்கள் அடுத்தடுத்த கேரக்டரா நடிச்சிட்டு வந்தாரு என்றால் திரும்பி பேக் டு த ஃபோம் அப்படி மாதிரியே கதைக்களம்பிலே இறங்கி விடுவாரு சொல்லலாம் சஞ்சிதா ஷெட்டி அவங்களுடைய துள்ளலான நடிப்பும் சரி ஆண்ட் பிரபு சாரோட அழகான நடிப்பு திறமையும் சரி பிரசாந்த் சாரை சொல்லவே வேண்டாம் அவருக்கு எல்லா திறமைகளுமே இருக்கு இதெல்லாம் சேர்ந்து கூடுதலான பலம் படத்துக்கு கிடைத்திருக்கு என்னே சொல்லலாம் பணம் படத்தில் மிகப்பெரிய பொருளா அமைஞ்சிருக்கு .சோ அப்படி இருக்கும்போது இளைஞர்களுக்கு எல்லாருக்குமே ரொம்ப ரசிச்சு பார்ப்பாங்க பிடிக்கும் அப்படின்னு கூட சொல்லலாம் சோ எவ்வளவு நேரம் படத்தினை பத்தின சின்ன அவுட்லைன் நம்ம பார்த்தோம்.d படத்துக்கு தரக்கூடிய மதிப்பெண் பாத்தீங்கன்னா அஞ்சுக்கு மூணு புள்ளி அஞ்சு
TAM_MSA_42,tam,NEUTRAL,வரலட்சுமி சரத்குமார் இதிலே செக்ரட்டரியா ஸ்பெஷல் செக்ரட்டரியா அப்பாயின்ட் பண்றாங்க எதுக்கு அப்படின்னு பார்த்தீங்கன்னா மாறி நல்லவனா கெட்டவனா அவனோட பேக்ரவுண்ட் அவனோட சிட்டுவேஷன் அப்படிங்கறத கண்டு பிடிப்பதற்காக ஸ்பெஷல் செக்கரட்டரியா இன்ட்ரோ கொடுக்கிறாங்க அவங்க பண்றாங்க அப்படின்னு பாத்தீங்கன்னா மாறிய பத்தி ரொம்பவே அலசி ஆராயராங்க அப்ப தெரிய வருது மாறி உண்மையாகவே ரொம்பவே நல்லவரு அப்படி என்றது ரொம்பவே அழகா காமிச்சிருக்காங்க படத்தில ரொம்பவே ஹைலைட்டான லைன் இருக்கீங்க அதாவது தனுஷ் சொல்வாரு அப்படின்னு பாத்தீங்கன்னா பொண்ண பொருளா பார்க்காத மனுஷியா பார்க்கணும் அப்படின்னு சொல்லிட்டு லைன் சொல்லியிருக்காரு அவரு நிஜ வாழ்க்கையில பயங்கரமான தில்லு முள்ளு பண்ணியிருந்தாலும் மாதிரி டயலாக் சொல்லும் கொஞ்சம் மனசுக்கு ஆறுதலா தாங்க இருக்கு படத்தில ரொம்பவே முக்கியமானது என்னன்னு பாத்தீங்கன்னா படத்தோட பெரிய பெரிய பிளஸ் பாயின்ட் என்னான்னு பார்த்தீங்கன்னா யுவன் சங்கர் ராஜா ஒட மியூசிக் அவருடைய ரவுடி பேபி சாங் அதுக்கப்புறம் மாரீஸ் ஆனந்தி சாங் பயங்கரமா பட்டைய கிளப்பி இருக்கு படம் ரிலீஸ் ஆகறதுக்கு முன்னாடியே பாக்ஸ் ஆபீஸ் ஹிட் அடிச்சிருக்காங்க படத்தை வேற லெவலுக்கு போயிருக்கிறது யுவன் சங்கர் ராஜா ஓட பி.ஜி.எம் தாங்க ஹீரோக்கு பி.ஜி.எம் ஹீரோயினுக்கு பி.ஜி.எம் வில்லனுக்கு பி.ஜி.எம் தனித்தனியா போட்டு பயங்கரமா பட்டைய கிளப்பியிருக்கிறாரு மாரி படம் சின்ன குழந்தையில் பெரியவங்க வரையும் எல்லாருமே ரொம்பவே பார்த்து ரசிக்கக்கூடிய படமாய் இருக்கு படத்துக்கு எஸ் மீடியா சேனல் கொடுக்கிற ரேட்டிங் என்னன்னா பாத்தீங்கன்னா
