TAM_MSA_01,tam,POSITIVE,பி.ஜி.எம் அப்படின்னு வரப்போ ரொம்ப அப்படியே மண்டையெல்லாம் குழப்பி மியூசிக் பண்ணல இதுக்கு இதெல்லாம் போட்டால் ரசிப்பாங்க அப்படின்னு சூப்பர்பா ஸ்கோர் பண்ணியிருக்கிறாரு அடுத்தது கேமராமேன் அவர்களை பத்தியும் சொல்லணும் அவரும் அவரோட போர்ஷன சூப்பரா பண்ணியிருக்காரு எல்லாரையும் அழகாக காட்டியிருக்காங்க இடத்திலேயும் இப்படி இருக்கு அப்படின்ரு இருக்குது அப்படின்ற டவுட் நமக்கு வரவே வைக்கல முக்கியமா மறுபடியும் சொல்றேன் படத்துல நீங்க லாஜிக்கும் எதிர்பார்க்கமுடியாது கதையும் எதிர்பார்க்க முடியாது ஆனால் உங்களுக்கு கலகலப்பு கண்டிப்பா காரண்டியா ரொம்ப நாளுக்கு அப்புறம் ஓகே ஓகே பட்டாம வருத்தப்படாத வாலிபர் சங்கம் ரேஞ்சில் ரொம்ப நாளா படம் வரலயே அப்படின்னு நீங்க வருத்தப்பட்டு இருந்தீங்கன்னா கண்டிப்பா ஏவண் எ மிஸ் பண்ணாம பாருங்க படத்தில நெகட்டிவ் அப்படின்னு பார்த்தீங்கன்னா சந்தானம் ஸ்கோர் பண்ணியிருக்கிறாரு அப்படினறதெ சொல்லிட்டேன் ஆண்டு எல்லாருமே அவங்க அவங்க பங்குக்கு பண்ணி இருக்கிறாங்க ஆனா அங்கங்க லாக் அடிக்கிதுங்க அவரைத் மீதி பண்றது கட்டாயத்தில காமெடிய கொமட்டுதோ அப்படின்ற மாதிரி எல்லாருக்கும் தோணுது மத்தபடி சொல்லணும் அப்படின்னா ஃபுள் அண்ட் ஃபுள் பிளஸ் பிளஸ் பிளஸ் குளந்தைகளில் பெரியவங்க வரைக்கும் பாட்டிய எல்லாருமே படத்தை ரசிச்சு பாக்கலாம் அப்படின்றே சொல்லலாம் சீசனுக்கு வீக்என்டுக்கு பயங்கரமா ஸ்கோர் பண்ணியிருக்கிறாரு அப்படின்னுதான் சொல்லணும்
TAM_MSA_02,tam,POSITIVE,சோ படத்தோட மிகப்பெரிய பிளஸ் அப்படின்னா இவங்க ரெண்டு பேரு மட்டும்தான் இவங்க ரெண்டு பேரும்தான் தாங்கி இருக்காங்க ஆன்ட் இவ  ங்க ரெண்டு பேரையும் செலக்ட் பண்ணது படத்துக்கு மிகப்பெரிய பிளஸ் மாதிரி ஸ்டோரி எடுத்துட்டு மாதிரி புது ஆர்டிஸ்ட் குட்டி பையன வெச்சு அதுவும் இல்லாமல் டாக வச்சு போகணும் அப்படின்ற ஐடியாவை படத்துக்கு பெரிய ப்ளஸ் சோ இதைத் தவரே மத்த ஆர்டிஸ்ட் எல்லாமே சப்போர்ட்டிங் கேரக்டர்தான் மத்தபடி படத்துக்கு ஃபுள் அண்ட் ஃபுள் பிளஸ் அப்படின்னா இவங்க ரெண்டு பேரும்தான் நெகட்டிவ் அப்படின்னா சொன்ன மாதிரி ஃபிளாஷ்பேக் சீனஸ் அதுமட்டுமில்லாம லாக் இத கட் பண்ணி இருந்தோம் அப்படின்னா பௌபௌ எல்லோருக்குமே பிடிச்சிருக்கும் .ஏன்னா இப்ப குட்டீஸுக்கு ஈஸியா புடிக்கும் இதைத் தவிர்த்து யங்ஸ்டர்ஸ பார்க்கிறாங்களோ இல்ல குடும்பம் பாக்குறாங்க அப்படின்னா அவங்க கூட ஈசியா கணக்டா அப்படின்று தோன்றது மியூசிக்க பத்தி சொல்லணும் அப்படின்னா ஆஹா ஓஹோ அப்படின்னு இல்லைன்னாலும் பரவா இல்ல ட்ராவல் .இப்போ எப்படின்னா நம்ப ஹைவேஸில ட்ராவல் ஆகுற மாதிரி அப்படியே போயிட்டு இருக்கு ஸ்லோவா சோ அதனால மியூசிக் ஹைலைட்டா இல்ல ரொம்ப டம்மியா அப்படி இல்ல.கதையோட ட்ராவல் ஆகுது அப்படி ன்னே சொல்லலாம் அதுவே போதுமே வேறென்ன சொல்ல முடியும்சோ இதுதான் ஒட்டுமொத்த பௌ பௌ படத்தோட பிரசெண்டேஷன் அண்ட் நல்லா இருக்கு கண்டிப்பா வீக் என்ட் நிறைய படங்கள் ரிலீஸ் ஆகருதனாலும் படம் எதார்த்தமான படம் டைம்ல வந்தது நல்ல வரவேற்புள்ள படமா அமஞ்சிருக்கு அப்படின்னே சொல்லணும் கண்டிப்பா பள பள படத்தைஇந்த வீகெண்ட் நீங்க குட்டீஸ் ஓட போய் பார்க்கலாம்
TAM_MSA_03,tam,POSITIVE,கண்ன்ட் சூப்பரா வொர்க் அவுட் ஆகியிருக்கு அதுமட்டுமில்லாம இன்னொரு பிளஸ் என்னன்னு கேட்டீங்கன்னா யாருமே ஓவர் ஆக்டிங் பண்ணல .யாருமே டல்ல்ஆகவும் பண்ணல செம பர்பாமென்ஸ் பண்ணி இருக்காங்க இதெல்லாம் பிளஸ் சொல்லலாம் முக்கியமான பிளஸ் எது கேட்டீங்கன்னா ஹிப் ஹாப் ஆதி பாடல்கள் கம்மியாக இருந்தாலும் ரசிக்கும் தன்மை விஷ்வலை சூப்பரா காட்டி இருக்காங்க .ஆனா பண்ணர மியூசிக்கே இனிமேட்டு தனியாக ஆல்பம் கண்டிப்பா ஆல்ரெடி இருக்கு இருந்தாலும் ஹிப்ஹாப் ஆதி அப்படின்னா ஓகே பக்கா கண்டிப்பா கதை இல்லைனாலும் கண்டிப்பா போகலாம் அப்படி விஷயம் விஷ்வல் நம்ம ஹிப்ஹாப் ஆதி ரெடி ஆயிட்டார் அப்படின்னு சொல்லலாம் இருந்தாலும் படத்தில் கதையே இருக்கீங்க .படத்தோட மைனஸ் அப்டின்னு கேட்டீங்கன்னா அதுதான் ராமர் பிஜிலி-ரமேஷ் வராங்க இருக்காங்க .அப்படின்னு போர்ஷனை சோ அவங்களோட பங்குக்கு பெருசா ஒன்னும் பண்ணலஅப்படின்னு சோ இதுதான் குறை அப்படின்னு சொல்லணும் ஆனா தியேட்டர்ல எல்லாரும் சிரிச்சாங்க நம்ம காதுல அப்படியே கலக்கலான இருக்கு கட்டத்தில் நம்மளும் கை தட்டின மாதிரி நம்மளும் சிரிக்கணுமா அப்படின்னு கேட்டீங்கன்னா மத்தவங்களும் நம்மளை தானா சிரிக்க வைக்கிறார்கள் அப்படியே இன்னொரு போஷன்சும் இநக்கு ரீசண்டா படங்களை எல்லா காரண்டியான படமா இருக்கு .அந்த வகையில் கோமாளி அப்படீங்கிர படவும் கண்டிப்பா நேரடியான படம் அப்படின்னு சொல்லலாம் வீக் எண்டு கண்டிப்பா நீங்க தியேட்டர்ல ஃபேமிலியோட படத்தை பாக்கலாம் இண்டிபெண்டன்ட் டேக்கு ரிலீஸ் பண்ணி இருக்காங்க எல்லாருமே ஹேப்பியா போனால் ஹாப்பியா வெளியே வரலாம்
TAM_MSA_04,tam,HIGHLY POSITIVE,சோ நடிச்சிருக்கிற கேரக்டர் பத்தி சொல்லணும் இருங்க சூஸ் பண்ண விதமே சூப்பர்பா பண்ணியிருக்காங்க நம்ம டுடி அப்படின்னு போட்டதுமே ஓகே சூரிய சர் எப்போவுமே அதாவது கருத்துள்ள பாடமாக இருக்கட்டும் சூரிய டிஃபரண்டாக ஸ்டோரி சூஸ் பண்ணுவாங்க சில்லுக்கருப்பட்டி அப்படி டைட்டில் வைத்திருக்கிறார்கள் அப்படிங்கிற மாதிரி நாங்க யோசிச்சோம் படம் பார்த்தால் அவ்வளவு வர்த்தா இருக்கு சோ வீக்என்டில் வேற லெவல் படம் அப்படின்னு படத்தை சொல்லலாம் படத்தோட டைரக்டர் நிறைய அவார்ட்ஸ் வரணும் னு சொல்லிட்டு சொல்லி இருக்கிறோம் இடத்திலேயும் தப்பும் பண்ணல வழக்கமா பிளஸ் அண்ட் மைனஸ் சொல்லுவோம் படத்திலே பிளஸ் அண்ட் மைனஸ் சொல்றதுக்கு ஒண்ணுமே இல்லீங்க எல்லாமே பிளஸ் போட்டுக்குற மியூசிக் ஆகட்டும் அவங்களே எடிட் பண்ணி இருக்காங்க டைரக்டர் அல்சோ அதுவும் நல்லா இருக்கு சினிமாடோ கிராஃபி அப்படீன்னா அவங்க நாலு செட் ஆஃப் பாட்டேண வைத்து அவ்வளவ தூரம் இதுதான் சின்ன பசங்க மிடில் ஏஜ் ஒல்டேஜ் கல்யாணம் ஆனவங்க அப்படின்னு செட்டா பிரிச்சு அவ்வளவு அழகாக காட்டி இருக்காங்க .சோ விஷயம் பார்த்து பார்த்து பார்த்து செதுக்கி பண்ணி இருக்காங்க .சோ படத்துக்கு எங்களுடைய பெரிய வாழ்த்துக்கள் பிளஸ் அண்ட் மைனஸ் சொல்லற அளவுக்கு படத்தில் எதுவும் பெருசா இல்ல இல்ல அப்படின்னு சொல்லலாம் படத்தை வீக் என்டு நீங்க ஃபேமிலியோட பாக்கணும் முக்கியமா குழந்தைகளை கூட்டிட்டு போகலாம் லவ்வர்ஸ் போகலாம் கல்யாணம் ஆனவங்க போகலாம் பெரியவங்க போகலாம் தயவு செய்து படத்தை தியேட்டர்ல போய் பார்க்கணும்
TAM_MSA_05,tam,NEUTRAL,சூப்பர் ஸ்டார் ரஜினிகாந்த் ஓட ஆக்டிங் பத்தி சொல்லியே ஆகணும் .சூப்பரா நடிச்சு இருக்காரு .அவரு கொடுத்த கேரக்டருக்கு நரய கேரக்டரை பண்ணியிருக்காங்க நிறைய படங்களில் ரஜினிகாந்த் டூப்பு வச்சு பண்றாரு அப்படி ஒர பேரு படத்துல தவிர்த்து இருக்காரு நிறைய அவரு ஓநா டூப்பில்லாம பண்ணி இருக்காரு பாராட்ட கூடிய விஷயம் அக்ஷய் குமார் அக்ஷய் குமாரை வைத்து பாடா படுத்தி இருக்காங்க ஐ படத்திற்கு விக்ரமை பாடா படுத்துற மாதிரி அக்ஷய் குமார்கும் பாடா படுத்துற மாதிரி அக்ஷய் குமாரை சொன்னாரு சோ அவருடைய கேரக்டர் நல்லா ஸ்ட்ராங்கா இருக்கு ஏ ஆர் ரகுமான் மியூசிக் ரொம்பவே கிளாஸ்ஸா இருக்கு ஆனா படத்துக்கு ஆறுதலை கொடுத்து கொடுக்கிறதே ஏ ஆர் ரகுமான் மியூசிக் ஷங்கர் படம் அப்படின்னா பிரம்மாண்டத்தை தாண்டி கதை அழகான மெசேஜ் படத்துல மெசேஜ் இருக்கு கண்டிப்பா மெசேஜ் இருக்கு ஆனால் கதை சுத்தமா இல்ல அப்படின்னு சொல்லணும் .முழுக்க முழுக்க விஷயத்துல காண்ஸன்ட்ரேட் பண்ண மறந்திட்டீங்களா அப்படிதான் இருக்கிறது அதுமட்டுமில்லாம படம் போற போக்கை பார்த்தால் அவசரஅவசரமாக எடிட் பண்ணி படத்த ரிலீஸ் பண்றதுக்காக ரிலீஸ் பண்ண மாதிரி  தோணுது அப்படின்னு ரசிகர்கள் சொல்றாங்க
TAM_MSA_06,tam,POSITIVE,பாபி சிம்ஹா பாபி சிம்ஹாவை பத்தி சொல்லியே ஆகணும்.ஜிகர்தண்டா இன்னொரு படம் வந்துருச்சு அதுல மாஸ் ஆன வில்லன் கேரக்டர் கொடுத்து இருப்பார் .அதே மாதி இதிலே ட்ரை பண்ணி இருக்காரு .அந்த அளவுக்கு இல்லைன்னாலும் அதுக்கு ஈக்வலா கொடுத்து இருக்கிரார் ரொம்பவே மாசா இருக்குது .லீட் ரோல் சூப்பரா இருக்கு படம்னு எடுத்துட்டா வில்லன் ஹீரோ இரண்டு பேருமே ஸ்ட்ராங்க் கேரக்டரா இருக்கணும் படத்துல ரெண்டு பேருமே ஸ்ட்ராங்கா இருக்காங்க ஆனா வச்சிருக்கிற டயலாக்ஸ் ரொம்ப வீக்கா இருக்கு அதுனால படம் கொஞ்சம் தொய்வு வருது அப்படின்னு சொல்லலாம் சினிமா டோக்ராஃபி பத்தி சொல்லியே ஆகணும் ரொம்ப அழகா தத்துரூபமான கேரக்டரை அழகா பிரசெண்ட் பண்ணியிருக்காங்க ரொம்பவே நல்லா இருக்கு மியூசிக் டிஎஸ்பி மாட்டு வண்டியில் சாமி மியூசிக் எவ்வளவு மாஸாக இருந்தாலும் மியூசிக் அப்படியே ரீ மிக்ஸ் பண்ணி போட்டு இருக்காங்க ஓகே ஆனா மாதிரிதான் இருக்கு பிஎஃப் எக்ஸ்  ரொம்பவே நல்லா இருந்தாலும் ஆம்பள படத்தில் கொஞ்சம் சுதப்பம் கார் பரக்கிர மாதிரி மாதிரி ரெண்டு மூணு சீன்ஸ் வச்சிருக்காங்க அப்படியே அப்பட்டமா தெரியுது கிராஃபிக்ஸ்னு விக்ரம் துணிந்து இறங்கி இருக்காங்க ஸ்டண்ட் பண்றதுல ஆனா கிராபிக்ஸில் லைட்டா தொய்வடைந்த மாதிரி தெரிகிறது மொத்தத்துல சாமி படம் ஃபேமிலி என்டர்டெயின்மென்ட் ரிவெஞ்ச் படமா இருக்கு ஃபேமிலி மட்டுமில்ல விக்ரமோட ரசிகர்களும் தியேட்டர்ல போயி நம்பிப் பார்க்கலாம் பாக்கலாம் தடவை பார்க்கலாம்
TAM_MSA_07,tam,HIGHLY POSITIVE,எந்தெந்த வருஷத்துக்கு எப்படி எப்படியெல்லாம் ஸ்கிரீன்பிளே பண்ணனும்னு அழகழகா கலர் கிரேடிங் போட்டு சூப்பரா காட்டி இருக்காங்க படத்தோட மியூசிக்க ப்பத்தி சொல்லணும்னா சந்தோஷ் நாராயணன் சூப்பரா கொடுத்து இருக்காரு அவரு பெஸ்ட் கேரியரை படம் வடசென்னையாக ஆயிருக்கும் அப்படின்னு சொல்லலாம் படத்துக்கான பிஜிஎம் இதுதாண்டா பிஜிஎம்மை தாண்டியும் போகக்கூடாது இதுல இறங்கியும் போகக்கூடாது அப்படிங்கற மாதிரி சூப்பரா இருந்துச்சு சந்தோஷ் நாராயணன் இதுல பெஸ்ட் கரியர் அப்படின்னு சொல்லலாம் படத்தில் மேக்கப் அப்படின்னு சொன்னா சுப்பிரமணியபுரம் அப்படின்னு படம் வந்துருச்சு அதிலுள்ள மேக்கப்மேன் அதான் இதுல போட்டு இருக்கேன் அப்படின்னு நினைக்கிறேன் ஏனா வருஷத்துக்கு ஆன கேட்ட கரிக்கு பெல்ட் போட்டு பங்கு வச்சுட்டு அப்படிங்கற மாதிரி வர்றாங்க .லைட்டா சுப்ரமணியபுரம் படத்தை பார்க்கிற மாதிரி லைட்டா இருக்கும்னு அப்படி ஃபீல் ஆயிடுச்சு மேக்கப்பு பத்தி எதுவும் சொல்ல மாட்டாங்க படத்துல சொல்ற மாதிரி கட்டம் இருக்கு ஏனா மேக்கப் வச்சிட்டுதான் எந்தெந்த காலத்தில் அப்படி சப்ரட் பண்றாங்க ரொம்ப சூப்பரா பண்ணி இருக்காங்க மொத்தத்துல வடசென்னை தனுஷுக்கு பெரிய பிளாக்பஸ்டர் சினிமயாக பிலிம் ஆமையும் ஏன்னா தனுஷோட ரசிகர் படத்தை பார்த்து ரசிக்காமல் நோர்மல் ரசிகர்களையும் கவர் பண்ண படத்தை முழுக்க முழுக்க வெற்றிமாறன் எடுத்திருக்காரு
